<?xml version="1.0" encoding="UTF-8"?>
<!DOCTYPE map SYSTEM "doc/file-formats/map-file.dtd">

<map bg="world.png">
  <meta>
    <author>Thomas Forss</author>
    <description>Made the continent reinforcements 2,3,4,5,6,7 (can easliy be changed) </description>
  </meta>


  <!-- continent europe -->

  <continent name="europe"
	     troops="5">
    <region name="spain">
      <circle>
	<point x="10" y="20"/>
      </circle>
    </region>
    <region name="balkan">
      <circle>
	<point x="10" y="20"/>
      </circle>
    </region>
    <region name="united kingdom">
      <circle>
	<point x="10" y="20"/>
      </circle>
    </region>
    <region name="western europe">
      <circle>
	<point x="10" y="20"/>
      </circle>
    </region>   
    <region name="eastern europe">
      <circle>
	<point x="10" y="20"/>
      </circle>
    </region>
    <region name="scandinavia">
      <polygon>
	<point x="10" y="20"/>
      </polygon>
    </region>
    <region name="iceland">
      <polygon>
	<point x="10" y="20"/>
      </polygon>
    </region>
    <region name="st. petersburg">
      <polygon>
	<point x="10" y="20"/>
      </polygon>
    </region>
  </continent>

  <!-- continent north america -->

  <continent name="north amerika"
	     troops="6">
    <region name="alaska">
      <polygon>
	<point x="10" y="20"/>
      </polygon>
    </region>
    <region name="western canada">
      <circle>
	<point x="10" y="20"/>
      </circle>
    </region>
    <region name="eastern canada">
      <circle>
	<point x="10" y="20"/>
      </circle>
    </region>
    <region name="northern canada">
      <circle>
	<point x="10" y="20"/>
      </circle>
    </region>
    <region name="greenland">
      <polygon>
	<point x="10" y="20"/>
      </polygon>
    </region>
    <region name="california">
      <circle>
	<point x="10" y="20"/>
      </circle>
    </region>   
    <region name="texas">
      <circle>
	<point x="10" y="20"/>
      </circle>
    </region>
    <region name="florida">
      <polygon>
	<point x="10" y="20"/>
      </polygon>
    </region>
    <region name="new york">
      <polygon>
	<point x="10" y="20"/>
      </polygon>
    </region>
    <region name="mexico">
      <polygon>
	<point x="10" y="20"/>
      </polygon>
    </region>
  </continent>

  <!-- continent south america -->

  <continent name="south america"
	     troops="3">
    <region name="venezuela">
      <circle>
	<point x="10" y="20"/>
      </circle>
    </region>
    <region name="colombia">
      <circle>
	<point x="10" y="20"/>
      </circle>
    </region>
    <region name="brazil">
      <circle>
	<point x="10" y="20"/>
      </circle>
    </region>
    <region name="peru">
      <circle>
	<point x="10" y="20"/>
      </circle>
    </region>   
    <region name="argentina">
      <circle>
	<point x="10" y="20"/>
      </circle>
    </region>
  </continent>


  <!-- continent africa -->

  <continent name="africa"
	     troops="4">
    <region name="algeria">
      <circle>
	<point x="10" y="20"/>
      </circle>
    </region>
    <region name="egypt">
      <circle>
	<point x="10" y="20"/>
      </circle>
    </region>
    <region name="congo">
      <circle>
	<point x="10" y="20"/>
      </circle>
    </region>
    <region name="south africa">
      <circle>
	<point x="10" y="20"/>
      </circle>
    </region>   
    <region name="tanzania">
      <circle>
	<point x="10" y="20"/>
      </circle>
    </region>
    <region name="madagascar">
      <circle>
	<point x="10" y="20"/>
      </circle>
    </region>
  </continent>

  <!-- continent asia -->

  <continent name="asia"
	     troops="7">
    <region name="ural">
      <circle>
	<point x="10" y="20"/>
      </circle>
    </region>
    <region name="siberia">
      <circle>
	<point x="10" y="20"/>
      </circle>
    </region>
    <region name="yakutsk">
      <circle>
	<point x="10" y="20"/>
      </circle>
    </region>
    <region name="chersky">
      <circle>
	<point x="10" y="20"/>
      </circle>
    </region>   
    <region name="japan">
      <circle>
	<point x="10" y="20"/>
      </circle>
    </region>
    <region name="china">
      <circle>
	<point x="10" y="20"/>
      </circle>
    </region>
    <region name="india">
      <circle>
	<point x="10" y="20"/>
      </circle>
    </region>
    <region name="iran">
      <circle>
	<point x="10" y="20"/>
      </circle>
    </region>
    <region name="saudi arabia">
      <circle>
	<point x="10" y="20"/>
      </circle>
    </region>
    <region name="thailand">
      <circle>
	<point x="10" y="20"/>
      </circle>
    </region>
    <region name="mongolia">
      <circle>
	<point x="10" y="20"/>
      </circle>
    </region>
  </continent>

  <!-- continent australia -->

  <continent name="australia"
	     troops="2">
    <region name="indonesia">
      <circle>
	<point x="10" y="20"/>
      </circle>
    </region>
    <region name="new guinea">
      <circle>
	<point x="10" y="20"/>
      </circle>
    </region>
    <region name="western australia">
      <circle>
	<point x="10" y="20"/>
      </circle>
    </region>
    <region name="eastern australia">
      <circle>
	<point x="10" y="20"/>
      </circle>
    </region>   
  </continent>

  <!-- continent australia links -->

  <link type="clique">

    <node name="indonesia"/>
    <node name="new guinea"/>
    <node name="western australia"/>
    <node name="eastern australia"/>
  </link>

  <!-- continent south america links -->

  <link type="circle">
    <node name="venezuela"/>
    <node name="colombia"/>
    <node name="brazil"/>
  </link>
  <link type="line">
    <node name="venezuela"/>
    <node name="brazil"/>
  </link>

  <link type="circle">
    <node name="argentina"/>
    <node name="brazil"/>
    <node name="peru"/>
  </link>

  <!-- continent africa links -->

  <link type="line">
    <node name="algeria"/>
    <node name="egypt"/>
    <node name="tanzania"/>
  </link>
  <link type="circle">
    <node name="algeria"/>
    <node name="congo"/>
    <node name="tanzania"/>
  </link>
  <link type="line">
    <node name="south africa"/>
    <node name="congo"/>
  </link>
  <link type="circle">
    <node name="south africa"/>
    <node name="madagascar"/>
    <node name="tanzania"/>
  </link>

  <!-- continent north america links -->

  <link type="line">
    <node name="florida"/>
    <node name="mexico"/>
    <node name="texas"/>
  </link>
  <link type="line">
    <node name="northern canada"/>
    <node name="greenland"/>
    <node name="eastern canada"/>
  </link>
  <link type="line">
    <node name="eastern canada"/>
    <node name="new york"/>
  </link>
  <link type="circle">
    <node name="western canada"/>
    <node name="california"/>
    <node name="alaska"/>
  </link>
  <link type="circle">
    <node name="eastern canada"/>
    <node name="northern canada"/>
    <node name="western canada"/>
  </link>
  <link type="circle">
    <node name="eastern canada"/>
    <node name="california"/>
    <node name="texas"/>
  </link>
  <link type="circle">
    <node name="new york"/>
    <node name="florida"/>
    <node name="texas"/>
  </link>

  <!-- continent europe links -->

  <link type="line">
    <node name="eastern europe"/>
    <node name="st. petersburg"/>
  </link>
  <link type="line">
    <node name="spain"/>
    <node name="balkan"/>
  </link>
  <link type="circle">
    <node name="western europe"/>
    <node name="spain"/>
    <node name="united kingdom"/>
  </link>
  <link type="circle">
    <node name="iceland"/>
    <node name="scandinavia"/>
    <node name="united kingdom"/>
  </link>
  <link type="circle">
    <node name="western europe"/>
    <node name="scandinavia"/>
    <node name="st. petersburg"/>
  </link>
  <link type="circle">
    <node name="western europe"/>
    <node name="eastern europe"/>
    <node name="balkan"/>
  </link>

  <!-- continent asia links -->

  <link type="clique">

    <node name="yakutsk"/>
    <node name="chersky"/>
    <node name="mongolia"/>
    <node name="japan"/>
  </link>
  <link type="line">
    <node name="japan"/>
    <node name="china"/>
  </link>

  <link type="line">
    <node name="ural"/>
    <node name="siberia"/>
    <node name="yakutsk"/>
  </link>

  <link type="circle">
    <node name="india"/>
    <node name="iran"/>
    <node name="china"/>
  </link>
  <link type="circle">
    <node name="mongolia"/>
    <node name="siberia"/>
    <node name="china"/>
  </link>
  <link type="circle">
    <node name="india"/>
    <node name="iran"/>
    <node name="saudi arabia"/>
  </link>
  <link type="circle">
    <node name="india"/>
    <node name="thailand"/>
    <node name="china"/>
  </link>

  <!-- intercontinental links -->

  <link type="line">
    <node name="thailand"/>
    <node name="indonesia"/>
  </link>
  <link type="line">
    <node name="chersky"/>
    <node name="alaska"/>
  </link>
  <link type="line">
    <node name="brazil"/>
    <node name="algeria"/>
  </link>
  <link type="line">
    <node name="greenland"/>
    <node name="iceland"/>
  </link>
  <link type="line">
    <node name="colombia"/>
    <node name="mexico"/>
    <node name="venezuela"/>
  </link>
  <link type="line">
    <node name="spain"/>
    <node name="algeria"/>
    <node name="balkan"/>
  </link>
  <link type="line">
    <node name="egypt"/>
    <node name="balkan"/>
    <node name="saudi arabia"/>
  </link>
  <link type="line">
    <node name="iran"/>
    <node name="eastern europe"/>
    <node name="saudi arabia"/>
  </link>
  <link type="line">
    <node name="ural"/>
    <node name="st. petersburg"/>
    <node name="iran"/>
  </link>
  

</map>
